{
  "name": "firelight",
  "version": "1.0.0",
  "schemaVersion": 2,
  "description": "A colour palette for interfaces and code.",
  "colorUnits": "RGB uses 0-255, HSL uses degrees and percentages, and OKLCH uses lightness 0-1, non-negative chroma, and hue in degrees.",
  "defaultVariant": "coal",
  "variants": {
    "coal": {
      "appearance": "dark",
      "description": "Dark, with neutral backgrounds and text shades that range from cool to warm.",
      "colors": {
        "bg0": {
          "group": "background",
          "hex": "#1B1A19",
          "rgb": {
            "r": 27,
            "g": 26,
            "b": 25
          },
          "hsl": {
            "h": 30,
            "s": 3.846154,
            "l": 10.196078
          },
          "oklch": {
            "l": 0.218511,
            "c": 0.002484,
            "h": 67.69611
          },
          "cssVariable": "--fl-coal-bg0"
        },
        "bg1": {
          "group": "background",
          "hex": "#232222",
          "rgb": {
            "r": 35,
            "g": 34,
            "b": 34
          },
          "hsl": {
            "h": 0,
            "s": 1.449275,
            "l": 13.529412
          },
          "oklch": {
            "l": 0.253044,
            "c": 0.001501,
            "h": 17.256362
          },
          "cssVariable": "--fl-coal-bg1"
        },
        "bg2": {
          "group": "background",
          "hex": "#353434",
          "rgb": {
            "r": 53,
            "g": 52,
            "b": 52
          },
          "hsl": {
            "h": 0,
            "s": 0.952381,
            "l": 20.588235
          },
          "oklch": {
            "l": 0.326047,
            "c": 0.001407,
            "h": 17.229773
          },
          "cssVariable": "--fl-coal-bg2"
        },
        "bg3": {
          "group": "background",
          "hex": "#484746",
          "rgb": {
            "r": 72,
            "g": 71,
            "b": 70
          },
          "hsl": {
            "h": 30,
            "s": 1.408451,
            "l": 27.843137
          },
          "oklch": {
            "l": 0.398539,
            "c": 0.002138,
            "h": 67.76293
          },
          "cssVariable": "--fl-coal-bg3"
        },
        "bg4": {
          "group": "background",
          "hex": "#5D5C5C",
          "rgb": {
            "r": 93,
            "g": 92,
            "b": 92
          },
          "hsl": {
            "h": 0,
            "s": 0.540541,
            "l": 36.27451
          },
          "oklch": {
            "l": 0.475696,
            "c": 0.001279,
            "h": 17.203243
          },
          "cssVariable": "--fl-coal-bg4"
        },
        "bg5": {
          "group": "background",
          "hex": "#777676",
          "rgb": {
            "r": 119,
            "g": 118,
            "b": 118
          },
          "hsl": {
            "h": 0,
            "s": 0.421941,
            "l": 46.470588
          },
          "oklch": {
            "l": 0.566712,
            "c": 0.001224,
            "h": 17.194728
          },
          "cssVariable": "--fl-coal-bg5"
        },
        "fg5": {
          "group": "foreground",
          "hex": "#818AA1",
          "rgb": {
            "r": 129,
            "g": 138,
            "b": 161
          },
          "hsl": {
            "h": 223.125,
            "s": 14.545455,
            "l": 56.862745
          },
          "oklch": {
            "l": 0.634032,
            "c": 0.036139,
            "h": 268.45748
          },
          "cssVariable": "--fl-coal-fg5"
        },
        "fg4": {
          "group": "foreground",
          "hex": "#9BA3B8",
          "rgb": {
            "r": 155,
            "g": 163,
            "b": 184
          },
          "hsl": {
            "h": 223.448276,
            "s": 16.959064,
            "l": 66.470588
          },
          "oklch": {
            "l": 0.715969,
            "c": 0.031866,
            "h": 268.999736
          },
          "cssVariable": "--fl-coal-fg4"
        },
        "fg3": {
          "group": "foreground",
          "hex": "#B3B5BC",
          "rgb": {
            "r": 179,
            "g": 181,
            "b": 188
          },
          "hsl": {
            "h": 226.666667,
            "s": 6.293706,
            "l": 71.960784
          },
          "oklch": {
            "l": 0.773628,
            "c": 0.010139,
            "h": 273.319953
          },
          "cssVariable": "--fl-coal-fg3"
        },
        "fg2": {
          "group": "foreground",
          "hex": "#CBC6C3",
          "rgb": {
            "r": 203,
            "g": 198,
            "b": 195
          },
          "hsl": {
            "h": 22.5,
            "s": 7.142857,
            "l": 78.039216
          },
          "oklch": {
            "l": 0.829717,
            "c": 0.006983,
            "h": 53.427191
          },
          "cssVariable": "--fl-coal-fg2"
        },
        "fg1": {
          "group": "foreground",
          "hex": "#E6D7CD",
          "rgb": {
            "r": 230,
            "g": 215,
            "b": 205
          },
          "hsl": {
            "h": 24,
            "s": 33.333333,
            "l": 85.294118
          },
          "oklch": {
            "l": 0.888533,
            "c": 0.021494,
            "h": 56.10026
          },
          "cssVariable": "--fl-coal-fg1"
        },
        "fg0": {
          "group": "foreground",
          "hex": "#F8EAE0",
          "rgb": {
            "r": 248,
            "g": 234,
            "b": 224
          },
          "hsl": {
            "h": 25,
            "s": 63.157895,
            "l": 92.54902
          },
          "oklch": {
            "l": 0.945412,
            "c": 0.020307,
            "h": 58.063813
          },
          "cssVariable": "--fl-coal-fg0"
        },
        "rose": {
          "group": "accent",
          "hex": "#F06B8A",
          "rgb": {
            "r": 240,
            "g": 107,
            "b": 138
          },
          "hsl": {
            "h": 346.015038,
            "s": 81.595092,
            "l": 68.039216
          },
          "oklch": {
            "l": 0.697026,
            "c": 0.165622,
            "h": 7.879354
          },
          "cssVariable": "--fl-coal-rose"
        },
        "ember": {
          "group": "accent",
          "hex": "#FF7C78",
          "rgb": {
            "r": 255,
            "g": 124,
            "b": 120
          },
          "hsl": {
            "h": 1.777778,
            "s": 100,
            "l": 73.529412
          },
          "oklch": {
            "l": 0.737072,
            "c": 0.160577,
            "h": 23.55396
          },
          "cssVariable": "--fl-coal-ember"
        },
        "coral": {
          "group": "accent",
          "hex": "#FF936F",
          "rgb": {
            "r": 255,
            "g": 147,
            "b": 111
          },
          "hsl": {
            "h": 15,
            "s": 100,
            "l": 71.764706
          },
          "oklch": {
            "l": 0.770447,
            "c": 0.139779,
            "h": 39.120209
          },
          "cssVariable": "--fl-coal-coral"
        },
        "apricot": {
          "group": "accent",
          "hex": "#FFB57A",
          "rgb": {
            "r": 255,
            "g": 181,
            "b": 122
          },
          "hsl": {
            "h": 26.616541,
            "s": 100,
            "l": 73.921569
          },
          "oklch": {
            "l": 0.830493,
            "c": 0.11441,
            "h": 58.89189
          },
          "cssVariable": "--fl-coal-apricot"
        },
        "honey": {
          "group": "accent",
          "hex": "#F8DC99",
          "rgb": {
            "r": 248,
            "g": 220,
            "b": 153
          },
          "hsl": {
            "h": 42.315789,
            "s": 87.155963,
            "l": 78.627451
          },
          "oklch": {
            "l": 0.902521,
            "c": 0.090216,
            "h": 87.823721
          },
          "cssVariable": "--fl-coal-honey"
        },
        "fern": {
          "group": "accent",
          "hex": "#99CC78",
          "rgb": {
            "r": 153,
            "g": 204,
            "b": 120
          },
          "hsl": {
            "h": 96.428571,
            "s": 45.16129,
            "l": 63.529412
          },
          "oklch": {
            "l": 0.789597,
            "c": 0.12465,
            "h": 133.99392
          },
          "cssVariable": "--fl-coal-fern"
        },
        "verdigris": {
          "group": "accent",
          "hex": "#62D4C5",
          "rgb": {
            "r": 98,
            "g": 212,
            "b": 197
          },
          "hsl": {
            "h": 172.105263,
            "s": 57,
            "l": 60.784314
          },
          "oklch": {
            "l": 0.799644,
            "c": 0.106337,
            "h": 183.837246
          },
          "cssVariable": "--fl-coal-verdigris"
        },
        "cornflower": {
          "group": "accent",
          "hex": "#8DB6FF",
          "rgb": {
            "r": 141,
            "g": 182,
            "b": 255
          },
          "hsl": {
            "h": 218.421053,
            "s": 100,
            "l": 77.647059
          },
          "oklch": {
            "l": 0.775214,
            "c": 0.114192,
            "h": 261.53992
          },
          "cssVariable": "--fl-coal-cornflower"
        },
        "lilac": {
          "group": "accent",
          "hex": "#C9C6F8",
          "rgb": {
            "r": 201,
            "g": 198,
            "b": 248
          },
          "hsl": {
            "h": 243.6,
            "s": 78.125,
            "l": 87.45098
          },
          "oklch": {
            "l": 0.845607,
            "c": 0.069329,
            "h": 287.565644
          },
          "cssVariable": "--fl-coal-lilac"
        },
        "orchid": {
          "group": "accent",